Author,Comment,Date,Time,Type
asdf30111,It is more then that. You know the girl and the men are not fully human at all. Just look like humans. They are descendants of humans today. They could be said to be transhumans as that is what they are.  Not magic like in Last Airbender but more science version of it.,10/26/2014,14:10:12,Reply
Daryl Jarvinen,This is just... Mind-blowing on so many levels. Amazing!,10/26/2014,13:06:45,Top Level
Garrett Harris,"i vote you all start doing the live action avatar, dragon ball, and naruto films... because this is justice for that supernatural ability.",10/26/2014,12:58:03,Top Level
Sad Clown,"Wow! Talk about inflated sense of self-importance and arrogance. Science do not need such people. Actually it hurts science. Gets in the way of it. Muddies the pure pursuit of knowledge with insignificant individual&#39;s egos, economical greed and other mental illnesses weak-minded and unintelligent people can not move past. Corruption. Slows down progress. etc, etc.<br />Animals! Cavemen!<br /><br />Nice sci-fi video though. Was a bit too short. Ended when it got good.",10/26/2014,12:28:09,Top Level
LepeshkaGoveshka,????????????? ???????. ?????? ???????.,10/26/2014,12:12:13,Top Level
one face,Littlefinger !!!!!,10/26/2014,12:05:53,Top Level
Francesco Pontillo,<span class=\"proflinkWrapper\"><span class=\"proflinkPrefix\">+</span><a class=\"proflink\" href=\"https,10/26/2014,11:57:57,Top Level
Daniele Bonaldo,"Wow, not bad at all!",10/26/2014,18:56:58,Reply
Rogers George,I wish it were longer!,10/26/2014,11:52:42,Top Level
PaoloCSGL,"troppo figo!Altro che Nasa e le sue noiosissime simulazioni,ESA rulez!!",10/26/2014,11:43:50,Top Level
Oliver Hollingdale,What is the music? Any chance of a download or a place to listen to it?,10/26/2014,11:26:53,Top Level
mizuki_fumiko,<a href=\"https,10/27/2014,16:34:01,Reply
mocaxu,"It&#39;s on soundcloud, look for Atanas Valkov  Ambition OST",10/26/2014,14:02:45,Reply
blizzard1108,This is stunning. Also watch this to have a tiny peek into the brilliance of the Rosetta Mission<br /><br /><a href=\"http,10/26/2014,11:08:56,Top Level
Eze Solis,"Girl, people die when they trust little finger.",10/26/2014,10:33:52,Top Level
TheSorrowLand,Game of Comets,10/26/2014,10:14:49,Top Level
Giacomo Boschi,Please do an italian subbed version ASAP!,10/26/2014,9:49:26,Top Level
symaxian1,This was outstanding!,10/26/2014,9:29:12,Top Level
Gimme The Hole All Right,peace for everyone,10/26/2014,9:18:58,Top Level
Astro Physics,Great Video European Space Agency! Hello from land of the NASA,10/26/2014,9:15:53,Top Level
White Light Express,To promote confidence for a sublime future where we succeed? Brilliant. Inspiring hope at a time when many feel that we are on the threshold of a disastrous Dark Age as a result of technology is pure consciousness. <br />Giant props to the collaboration producing this advertisement; for having the genius and &quot;Ambition&quot; to dump the &quot;fear&quot; in Days of Fear and Wonder. <br /><br />Science is not the enemy. It is the answer. <br /><br />Perhaps &quot;God&quot; is the greatest scientist of all?  ,10/26/2014,8:51:54,Top Level
Terez Williamson,This was sensational!,10/26/2014,8:50:51,Top Level
Josie Nemo,"This is the best movie I&#39;ve seen in... idk, ever? Nano-wizardy, ecoforming, the focus and message, just yes!If there can be more, please make it happen. Please.",10/26/2014,8:37:54,Top Level
Martin Skywatcher,"Humbug, what a waste of money this totally unrealistic video. I like the mission, but this is total utter nonsense.",10/26/2014,8:35:58,Top Level
attlee2010,"Wow, this needs to be a film",10/26/2014,8:16:17,Top Level
Wojciech Kozlowski,Baginski as always. SUPERB! ,10/26/2014,7:48:33,Top Level
Daniel Sparks,THIS IS AMAZING!!!!,10/26/2014,7:45:45,Top Level
Ivory Oasis,This was a lot of work for a commercial about the rosetta mission ~_~ lol,10/26/2014,7:45:32,Top Level
Nic Lopez,Isn&#39;t that the guy from GOT?,10/26/2014,6:46:43,Top Level
Kaetlynn Gabrielle Romero,Yep! That&#39;s Peytr Baelish/Littlefinger,10/26/2014,23:55:46,Reply
CommanderSanta,Who the f*ck dislikes this video?? Seriously...,10/26/2014,5:57:21,Top Level
Javier Luz,This looks freakin amazing! This should be a full movie...,10/26/2014,5:54:46,Top Level
Hugo Stiglitz,Was getting the rock destroyed part of your master plan?,10/26/2014,5:51:33,Top Level
alive4ever1,"Join Scientific Transhumanism, one day we will make planets with our will. That is our ambition. <br /><a href=\""https",10/26/2014,4:33:00,Top Level
alive4ever1,Transhumanists planet formers. ,10/26/2014,4:31:19,Top Level
Catcher,pretty cool,10/26/2014,3:45:22,Top Level
CHRIS BALL,My ambition is definitely to get my grand daughters (4 and 6) exited for science but right now I have a lot of competition in Barbie and Disney Princesses dah!,10/26/2014,3:45:17,Top Level
VirulentSkills,Don&#39;t trust him little girl!,10/26/2014,3:40:12,Top Level
asdf30111,Why not?,10/26/2014,14:15:43,Reply
Daniel Dahlman,w.....o.....w!,10/26/2014,3:35:37,Top Level
CHRIS BALL,"I understand it takes a few hours for Philae to land on the surface, I will definitely be glued to the life streaming.GOOD LUCK to the Rosetta and Philae team!",10/26/2014,3:33:06,Top Level
Josh Nankivel,Fantastic!!! If only more science and engineering missions did this kind of thing to capture the public imagination and convey the significance involved.,10/26/2014,3:11:03,Top Level
Lucy Moreno,Where can I get the music to this @_@ ,10/26/2014,3:08:46,Top Level
Dinglie Danglie Doodle,Lies!!! People should know better than to trust one word this guy says. Never trust him; it could even get your head lobbed off.<br /><br />Chaos isn&#39;t a pit......,10/26/2014,2:59:32,Top Level
XiY3n,The ESA has the right idea when it comes to getting people excited about space exploration.,10/26/2014,2:56:41,Top Level
Clark Kent,"Very, very well done!",10/26/2014,2:47:28,Top Level
Guilty Spark,Amazing!,10/26/2014,2:21:54,Top Level
DJ Mergur,The voice Aiden Gillen uses here would actually fit better for Littlefinger than this weird creepy whisper voice he uses in the show,10/26/2014,2:21:02,Top Level
skyguard1000,"Can&#39;t you see he&#39;s the teacher and she&#39;s the student, if they are learning how to use something as powerful and dangerous as nanotechnology specifically nano assemblers and disassemblers near perfect control would be necessary to ensure that we didn&#39;t destroy the solar system. She must be in both the correct mental and emotional state to ensure that control. Imagine if she had lashed out in anger the destruction would have been tremendous.",10/26/2014,1:51:36,Top Level
asdf30111,I doubt anyone would mind if destruction did happen. He may get upset but that it. It will not be that hard to reset the world.,10/26/2014,14:17:26,Reply
camofelix,That was epic,10/26/2014,1:51:28,Top Level
kazzdude1,Was that Littlefinger from Game of Thrones?,10/26/2014,1:51:27,Top Level
Justin Wimmer,This was amazing. Why cant we make actual movies like this? I could watch this for hours... on a side note Aiden Gillen could be an amazing Doctor Who! ,10/26/2014,1:49:50,Top Level
Skyturnip,EAS,10/26/2014,1:46:28,Top Level
SecretLars,Don&#39;t trust him! Little finger always lies!!!,10/26/2014,1:45:54,Top Level
Phoenix Dawn,Probably one of the best promotional videos ever made!,10/26/2014,1:40:27,Top Level
hAnus criminal,Little Finger would be a good Jedi Master.,10/26/2014,1:36:12,Top Level
Jordan Link,Gorgeous video...and I knew that actor was familiar,10/26/2014,0:38:56,Top Level
joe4324,"We need more of THIS ^  We can change the world and instill hope for the future for all of us if we can create a sense of adventure and desire to look upward, and outward. Then we can move on from what we are being sold today.  ",10/26/2014,0:09:51,Top Level
Jester180193,???? ??????? ????????,10/25/2014,23:36:32,Top Level
Googs5,"What it&#39;s like to chew 5 Gum, the movie!",10/25/2014,23:24:20,Top Level
Matt Molloy,Awesome!,10/25/2014,23:17:02,Top Level
mycroft16,"Truly an amazingly well produced film. Creates a sense of wonder and magic and then uses current events as the film&#39;s history to drive curiosity. I want to see more of this story, both in today&#39;s perspective as it is happening, and from this future standpoint as a history lesson between teacher and student.<br /><br />Ambition, drive, the need to know and explore. Pushing humanity forward throughout the ages, crossing continents, then oceans and finally reaching out into the dark skies.",10/25/2014,23:14:08,Top Level
Sam M.,"Outstanding. What a great way to enlighten the public to the significance of such missions and to the wonders of science in general. Well done, ESA.",10/25/2014,22:58:44,Top Level
pachucf,ambitiosus movie,10/25/2014,22:54:15,Top Level
Spartwo,He just sounds like he was being an arsehole at <a href=\"http,10/25/2014,22:52:52,Top Level
Charles Quarra,This is so frigging cool. Oh my. Absolutely. Cool. Must watch again,10/25/2014,22:42:25,Top Level
Eurrsk Ruk,AMAZING!!!!!!!!!!!!!!!!!!!!!!!!!!!!!!!!!!!!!!!!!,10/25/2014,22:06:11,Top Level
celroid532,I like ESA a lot more now,10/25/2014,21:54:48,Top Level
Holdin McGroin,DR PAVEL I&#39;M ESA,10/25/2014,21:22:44,Top Level
eodezis,? ??????? ??? ????? ???????? ?? ??????,10/25/2014,21:21:15,Top Level
David Björn,this is like avatar how they put control in elements and ourselves its like some kind of travel in our existence in the universe.,10/25/2014,21:19:01,Top Level
Michael Oghia,18 people fail at life,10/25/2014,21:15:00,Top Level
The Video Game Nut,"He looks like a big guy, is he?",10/25/2014,21:14:29,Top Level
kimo mimo,I love how you use the creativity of science and technology to cause the human race to evolve in your movie . I am writting a story that envisions humans gaining &quot; magical&quot; abilities thru the use of nanites and what is even smaller . my ambition is to create a story that helps propel the human imagination of what &quot;we&quot; as human should be thru the power of technology . what was once considered magic is now reality and what we now consider impossible will one day become possible . only thru the power of the mind and our undying curiosity will be able to unlock the universes greats secrets and venture beyond that . ,10/25/2014,21:09:46,Top Level
Robert S. (NSPanamera),"This is such an awesome film, I absolutely love it.  Brilliant job, ESA.<br /><br />Also, does anyone happen to know the name of the credits song?  It sounds so great. (unless, Platige Image/ESA custom composed it)",10/25/2014,21:05:15,Top Level
Robert S. (NSPanamera),<span class=\"proflinkWrapper\"><span class=\"proflinkPrefix\">+</span><a class=\"proflink\" href=\"https,10/26/2014,23:34:05,Reply
Vane Fal,<a href=\"https,10/26/2014,23:32:10,Reply
RichieDev x,Made by polish director,10/25/2014,21:00:20,Top Level
llamaMonstA,So this is what the ESA spends their money on?,10/25/2014,20:47:00,Top Level
Nipple viking,"Who else was brought here by the BBC news app? Also really cool video, it&#39;s always fantastic to see a truly interesting European lead mission combined with Lord Baelish!  ",10/25/2014,20:46:04,Top Level
Diana Diehl,What incredible world building!   <a rel=\"nofollow\" class=\"ot-hashtag\" href=\"https,10/25/2014,20:43:35,Top Level
Kapil D Nayar,Holy sh*t the CGI is fun*king brilliant ,10/25/2014,20:34:04,Top Level
CrowHavenObservatory,Loved it!,10/25/2014,20:31:41,Top Level
grey robert,i want more,10/25/2014,20:27:16,Top Level
Ondra Nuhlícek,Love it! Great fusion of art and science!,10/25/2014,20:12:55,Top Level
Ginny855,I didn&#39;t know Lord Baelish works for ESA,10/25/2014,20:06:56,Top Level
dbskylark,Gave me chills! Cannot wait for November ,10/25/2014,19:55:52,Top Level
Ben L,So this is what Little Finger is after all along,10/25/2014,19:53:17,Top Level
Bob Kerman,this is much better than the last airbender the movie<br /><br />also keep up the great work esa!,10/25/2014,19:44:25,Top Level
Mike Abundo,Now THIS is how to promote space exploration!,10/25/2014,19:42:51,Top Level
Jacob S.,The thirst is real,10/25/2014,19:40:35,Top Level
Tim Gragg,Magnificent,10/25/2014,19:37:44,Top Level
Mike JB,Excellent.,10/25/2014,19:35:13,Top Level
Austin Wigley,"So, they&#39;re terraforming a new world using water from objects in orbit, right?",10/25/2014,19:28:14,Top Level
Arek Salata,<span class=\"proflinkWrapper\"><span class=\"proflinkPrefix\">+</span><a class=\"proflink\" href=\"https,10/25/2014,21:14:37,Reply
Sandrika 86,That&#39;s all??? I thought it would be a movie! nice ad though. ,10/25/2014,19:27:10,Top Level
N Ahmed,I love Aiden Gillen and I love sci fi. This is epic. ,10/25/2014,19:26:49,Top Level
Sid Brandt,This reminds me of Avatar,10/25/2014,19:06:43,Top Level
Sid Brandt,"&quot;Once upon a time,&quot;<br />&quot;Really?&quot;<br />&quot;This is a good one, I promise.&quot;",10/25/2014,19:03:56,Top Level
Indy Kochte,"Oh, seriously, you guys need to post this on Vimeo, too.",10/25/2014,19:03:01,Top Level
Cacophaton,Wait - No ! It can&#39;t be so short. It&#39;s brilliant. It should last longer !,10/25/2014,18:55:57,Top Level
dsa das,Was creating water part of your plan?,10/25/2014,18:52:57,Top Level
zahaz zahaz,?????,10/25/2014,18:43:30,Top Level
Pavel Kozhev,Can you add subtitles? At least english. Pleeeeease???,10/25/2014,18:20:18,Top Level
namen loss,Petyr Baelis is a magician!,10/25/2014,18:09:18,Top Level
Arturo Gutierrez,"Is that the same place where they filmed the battle between Loki, Thor and the elf guy in the lastest <i>Thor</i> movie?",10/25/2014,18:07:44,Top Level
Roman von Ungern,CIA Agent,10/25/2014,18:07:31,Top Level
Hubert Vanderhoven,"As shown in the film, Rosetta will be the start to a much bigger and ambitious adventure in our solar system. If we look back on 50 years ESA there are already a lot of milestones we have achieved, but certainly there will be much more to come. Good luck and let the battle begin.",10/25/2014,18:00:04,Top Level
mikeystocky,Love it! ,10/25/2014,17:57:30,Top Level
eundas' channel,Do you plan to provide subtitles? I&#39;d happily volunteer to translate to Spanish. Otherwise it may be hard for kids in non-English-speaking countries to enjoy this wonderful movie.,10/25/2014,17:38:24,Top Level
Christopher D'Andrea,Every human being should watch this video right now,10/25/2014,17:18:52,Top Level
Ahmed Ghazwan,"This was great. And also, Little Finger has changed.",10/25/2014,17:17:02,Top Level
ytrnjdikzgt,"Not impressed. It&#39;s all been - read earth ashes, listen music of grass, song of sands. Media, effects, to impress a man of todays - deaf, blind, empty and helpless. All in vain. War with us, we&#39;ll bring it to Universe.<br />Though good luck 2 Rosetta.<br />And thx to Phil Plait and his Bad Astronomy !",10/25/2014,17:15:48,Top Level
Florian Gueliat,"And put subtitles for those who do not understand English , it would have been too complicated for a European agency ?",10/25/2014,17:14:54,Top Level
Arxadius Stark,The visuals for this are mind-boggling!! ,10/25/2014,17:01:48,Top Level
PaVLeGio,just fantastic,10/25/2014,17:00:56,Top Level
Peter K,Tomek ...you and all team done well...you are all ready ...,10/25/2014,16:59:15,Top Level
videoeyez2,"Great video effects job. Unfortunately, for the intended audience of scientifically illiterate people who are in the great majority, this short film will make little to no sense to them. As one of the video animation artists working on the film referred to it, &quot;The actual campaign idea is certainly well targeted. But, shooting myself in the foot a bit. I&#39;m very surprised you need something like this at all now. Mankind sends a prob into space to catch a comet and land on it. And we need a great director, film and actors to convince people this is interesting?&quot;",10/25/2014,16:28:16,Top Level
Caleb Jones,Imagine a world where we had courage to continue in space exploration....,10/25/2014,16:27:06,Top Level
JohnnyNismo,"Subscribed! <br /><br />We need more of this to get the younger generations inspired about space exploration again. We need to seize our destiny, for it is in the stars!",10/25/2014,16:25:38,Top Level
A. Lawrence “Oz” Onek,<a rel=\"nofollow\" class=\"ot-hashtag\" href=\"https,10/25/2014,16:20:40,Top Level
El Burrito,Very cool,10/25/2014,16:05:39,Top Level
Corey Turnbull,wow,10/25/2014,16:04:54,Top Level
Starleader,tracklist please.),10/25/2014,15:49:48,Top Level
ImperatorAdeptus,Bane?,10/25/2014,15:41:31,Top Level
Laura Zelli,Wow!,10/25/2014,14:56:50,Top Level
Miguel Lopes,EXCELLENT!!!! ,10/25/2014,14:41:32,Top Level
VeritasPrima,An interesting take on an old idea...<br />I like it.,10/25/2014,14:23:01,Top Level
asdf1f8,bane?,10/25/2014,14:00:41,Top Level
BLACK_WOLF,&quot;I was watching you earlier. You remind me of your mother.&quot;,10/25/2014,13:37:59,Top Level
30STMcwa,wow,10/25/2014,13:30:11,Top Level
Shallaska,Holy shit it&#39;s CIA!,10/25/2014,13:26:16,Top Level
Handbanana,"Dr Pavel, I&#39;m ESA",10/25/2014,12:55:15,Top Level
xira,Bane?,10/25/2014,12:55:06,Top Level
goatmonkey2112,That was awesome.  But add a mustache and that guy could take over for Littlefinger. ,10/25/2014,11:52:01,Top Level
goatmonkey2112,Well that would explain it then.  He looks different enough without the mustache that I thought it wasn&#39;t actually him.,10/25/2014,12:16:07,Reply
Andreas Schepers,"It&#39;s Aiden Gillen, well known as Littlefinger in GOT ;-)",10/25/2014,12:10:41,Reply
Russell Harris,"Great film, hope it goes well on the 12th.",10/25/2014,11:35:01,Top Level
Mikael Murstam,"First I thought it was &quot;Meh&quot;, but when they referred to our history, more precisely the Rosetta mission, it became really awesome!!!",10/25/2014,10:52:24,Top Level
Louis Michael Ouano,"They should have made this into a freakin Movie, it would have been interesting when Gods were playing with humanity.",10/25/2014,10:25:12,Top Level
atonalfreerider,"I love it how men are still patronizing women in the future....<br />Also - how white people are seemingly the rightful inheritors of future god-like technologies...<br /><br />We can rendezvous a satellite with a comet but we are incapable of breaking out of our racial and gender narratives in film? I&#39;m a white male and I&#39;m even sick of this. Shame on us, let&#39;s do better people.",10/25/2014,9:50:05,Top Level
asdf30111,I do not think you got the point of these short film at all. Also there was no patronizing it is all in your head.....,10/26/2014,14:30:15,Reply
Arne Babenhauserheide,"Woah… A few weak spots where it could have used a tighter editing of the text, but what an ending!<br /><br />Now I just wish for a geman dubbed version I can show my kids.<br /><br />And I actually have tears in my eyes…",10/25/2014,9:37:57,Top Level
Christian Gardner,"Can we make this into a full length film, I&#39;d watch the shit out of this.",10/25/2014,9:35:29,Top Level
Miguel Veloso,Uma palavra,10/25/2014,9:31:08,Top Level
XY Dexter,Nice;)),10/25/2014,9:22:35,Top Level
Slonca Szum,Swietna robota!,10/25/2014,9:21:45,Top Level
dushevka,The imagery is insane. Amazing film!,10/25/2014,9:14:55,Top Level
JL STRAW,"This is truly inspiring, I want to watch a full length feature of it! Please release a DVD (complete with soundtrack)! <br /><br />Long shot I know",10/25/2014,9:14:33,Top Level
JL STRAW,I know right? Amazing!,10/25/2014,9:42:28,Reply
Goldsmith,Freaking awesome.,10/25/2014,9:35:23,Reply
Jan Maszczyszyn,"Staggering, awesome piece of art. The first installment of optional SF movie &quot; Terraformers&quot; and behind it marvelous Rosetta mission. Little-finger was great in his master&#39;s role. Love an idea.of science promotion.",10/25/2014,8:37:11,Top Level
Stresser Alex,"After littlefinger became king of Westeros he asked the meisters to do concoct a potion of immortality. Through the ages he secretly inflitrated many important agencies all in pursuit of the thing he considers the most important source of power-&gt; knowledge. On one notable occasion, after joining the CIA and rising through the ranks, he wanted to find out how Bane managed to escape from a prison that nobody could escape from so he took the mission to capture him, but that backfired. Ofc, he didn&#39;t die coz he is immortal.<br /><br />Now, we see him in the future, after many many centuries, he finally go the point where he has mastered powers that we can just dream about now. ",10/25/2014,8:33:13,Top Level
Timepiece Enthusiasm,MAKE A MOVIE !!!,10/25/2014,8:18:07,Top Level
NeonsStyle,Excellent..,10/25/2014,8:11:49,Top Level
bagrym,"nicely done, better cgi than many high budget movies these days.",10/25/2014,8:03:12,Top Level
Manuelomar2001,Truly spectacular!,10/25/2014,7:48:33,Top Level
tobitege,"Fantastic visuals, great cast and compelling storyline for the efforts made in space science! Imagine if in the future scientists could describe the story as a &quot;normal day in the lab&quot;.",10/25/2014,7:39:53,Top Level
Shadowkey392,WHOAHOAHOAWESOME!,10/25/2014,7:25:55,Top Level
Andrei Dobre,Really nice work. Science should definitely be advertised more through such spots. There is nothing more awesome than science.,10/25/2014,7:21:39,Top Level
fun1k,"Shiiiiet, this is fucking awesome!!!!",10/25/2014,7:21:37,Top Level
SilverbackRon,Truly spectacular work on this.  I love seeing the ESA doing such cutting edge science and I was blown away by this film short. ,10/25/2014,6:22:07,Top Level
wilowhisp,Well done esa! I can&#39;t wait for more short films like this and I hope Nasa follows this lead.,10/25/2014,6:17:17,Top Level
str8todamoney,Atanas Valkov your music is delightful.,10/25/2014,6:07:39,Top Level
Bryan Headley (Vassteel),"wow, if this was a full length movie i would definitely watch it several times",10/25/2014,6:07:21,Top Level
URAGANU,Gorgeous!<br /><br />You should do a full time movie or series based on this!,10/25/2014,6:00:56,Top Level
moonshiry,Looks like Petyr still has that swagger from game of thrones ,10/25/2014,5:09:38,Top Level
gjms,This is how science needs to be portrayed for highlighting its wonders to new generations!,10/25/2014,5:05:56,Top Level
SonOfTerra92,Littlefinger//,10/25/2014,5:02:53,Top Level
insanemadcat9,I might end up really getting into these scifi short films ,10/25/2014,4:43:22,Top Level
yash sharma,"I never understood what the hell he said in GOT and i still don&#39;t know what this video wanted to depict, man this actor is good!",10/25/2014,4:24:26,Top Level
The frenchy,"really cool ! little finger is indeed ambitious .... also impressed by the quality of this short interesting fun film and give my regards to this Rosetta mission --- as a fellow movie sci fi geek , but also scientific and human being. ",10/25/2014,4:13:03,Top Level
SaGeOne,Awesome. I only wish it was longer.,10/25/2014,4:10:51,Top Level
Grundle Wizard,"So I guess they made Westeros together, Littlefinger teaching her the powers of manipulation and talking about his ambitions like he does - much like he&#39;s doing at the moment with Sansa - and in Game of Thrones fashion, she backstabbed him somehow, probably at a wedding, and trapped him there.<br />I get it.",10/25/2014,3:51:11,Top Level
apeirrron,That was so good!,10/25/2014,3:21:09,Top Level
Edward Smith,Want......MORE!!!! Honestly I would love to see a full length movie inspired off of this.,10/25/2014,3:19:48,Top Level
doug lamssies,Beautiful an powerful.,10/25/2014,3:13:31,Top Level
olternaut,This needs to be a full length movie.,10/25/2014,2:53:30,Top Level
Haniff Din,Wow that was amazing! 10/10.<br />This was ambitious science story telling. Worked a treat ! <br />Like to see more stuff like this.,10/25/2014,2:49:50,Top Level
Matthew Miller,That was super cool. Good luck ESA!,10/25/2014,2:46:56,Top Level
Balliard M,Dr. Strange,10/25/2014,2:38:55,Top Level
Jovon Tron,Cool. This should be turned into a sci-fi show. ,10/25/2014,2:35:40,Top Level
Alex Bergeron,What is the song when she starts her power. ,10/25/2014,2:33:59,Top Level
Hai Hoang,awesome... ,10/25/2014,2:26:43,Top Level
Axel Villar,"Dr. Strange, Im ESA",10/25/2014,2:26:08,Top Level
WestAirAviation,That was... VERY good.,10/25/2014,1:30:54,Top Level
Paulo Jorge da Silva Pinto (paulo50001),1,10/25/2014,1:08:41,Top Level
Greg Hortin,Very cool. ,10/25/2014,0:39:54,Top Level
Roman Juranek,Great job,10/25/2014,0:28:29,Top Level
Apogeebooks,Now that&#39;s what I call target marketing. Very well done. Lessons for everyone here who thinks we need to get kid&#39;s attention and get them to have some Ambition. Bravo,10/25/2014,0:04:04,Top Level
Mana Brau,very well done!,10/24/2014,23:38:35,Top Level
MrNuxi,Beautiful!,10/24/2014,23:38:06,Top Level
Krewe of Ngaemond,"I don&#39;t mean to disagree with the video, and probably misunderstanding on my part, but a few months ago heard an outstanding lecture about liquid on Mars by a geologist from nearby university to our local astronomical society. Toward the end of his lecture he made the point that - and this is something of a surprise to many - most water on moons/planets in solar system comes from <b>inside</b> planetary bodies. And is brought from inside to surface by volcanic activity. Not the result of comets or other icy bodies slamming into them. I was stunned. So comets are interesting, potentially near inexhaustible source of water, but... is that really where water on earth comes from?",10/24/2014,23:27:38,Top Level
zarkoff45,"Those characters and their world were interesting. I wish their were more. So much about them isn&#39;t known -- just that they have remarkable powers, probably in the far future, and an interest in the history of space exploration.",10/24/2014,23:16:32,Top Level
John C. 'Buck' Field,Ambition Mod for Minecraft 8 running on Oculus 4.1 - Coming Soon,10/24/2014,23:15:04,Top Level
