Author,Comment,Date,Time,Type
André Luiz,JESUS SAID,01-11-2015,16:17:56,Top Level
Dame Des Etoiles,Amazing ! Really interesting ! <br />Thank u for this experience ! ,01-10-2015,9:38:44,Top Level
Darek Lenovo,"Zniszczylem twoja pewnosc siebie, bylem ciekaw jak zareagujesz, nie jestes pierdolona skala. To mialem  Zrozumiec ? chujowy sposób ale zadzialal ...   ",01-09-2015,21:36:54,Top Level
Yang Lan,Lord Balish educating the next One True God~~~,01-07-2015,4:18:09,Top Level
Darek Lenovo,"Ambicja,  Upór, Nic sie nie zmienilo. ",01-04-2015,10:09:46,Top Level
Scarlet Nguyen,OMG. I just can&#39;t say how inspiring it is to me. <br />Thank you.,12-11-2014,14:12:10,Top Level
originalname7890,Comets are made of ice? lol,12-10-2014,7:25:19,Top Level
Marcos Chibly,one day humankind will to do it!,12-08-2014,19:59:01,Top Level
David Harrison,"Do, or do not.  There is no try.",12-02-2014,1:40:30,Top Level
Caspar xLKEY,how the hell is it possible to dislike that movie?!,11/28/2014,22:55:37,Top Level
waypastbedtime,The money would maybe have been best spent on better batteries.,11/22/2014,23:53:55,Top Level
riordian2,"It feels epic when you watch this, but this, talking about a real deal, it makes me joyous about our species.",11/21/2014,22:13:19,Top Level
nukeboy27,To bad it fucking failed,11/21/2014,4:51:11,Top Level
Vane Fal,Let us propose 12 November be always our wonderful COMET DAY,11/20/2014,16:53:43,Top Level
ikra,I FUCKING LOVE SCIENCE!,11/18/2014,22:59:46,Top Level
Jay Vedanaya,Wohteh..,11/18/2014,2:55:45,Top Level
Zangetsu Ichirin,"I watched and rewatched this movie a hundred times, and every single time I&#39;m amazed like a child discovering something really interesting for the first time. Thank you for this short production, it is my favourite inspirational movie",11/15/2014,23:23:59,Top Level
XIIINON,I think. I think you&#39;ve got to make a full feature with these characters in the same universe. I would back it.,11/15/2014,8:11:52,Top Level
Nustechnologybahamas,I have been following for years.,11/14/2014,23:17:15,Top Level
Idelis Stamitte,My future decendants will be benders! Here&#39;s hoping they become Avatars ,11/14/2014,16:20:02,Top Level
Katarzyna Kowalska,"Masterpiece, I rest assured that the Witcher movie will be awesome",11/14/2014,10:50:24,Top Level
Radu L,Thank You Rosetta&amp;Philae,11/14/2014,3:10:49,Top Level
MissfireJack,I can&#39;t possibly communicate in words how awesome this whole mission is! The fact that we were able to land on a freaking comet is just so amazing! I can&#39;t wait to see what else comes from this. It&#39;s just amazing.,11/13/2014,23:58:03,Top Level
Piotr Malewski,"Zastanawiam sie, czy scenariusz tego filmu to aluzja do hipotetycznej mozliwosci uzyskania przez ludzi &quot;boskiej&quot; mocy na skutek postepu technologicznego, czy po prostu wstawiono taka fantastyczna oprawe bo zalozono, ze przecietnego dzisiejszego czlowieka nie zainteresuje nic realnego ani na tyle skomplikowanego zeby zrozumienie wymagalo jakiegos wysilku.",11/13/2014,16:36:24,Top Level
scott wooten,oh my glob,11/13/2014,5:44:12,Top Level
ncdefenceman,Incredible ,11/13/2014,3:42:43,Top Level
Ryan C,"Very cool. Go Europe and the ESA!<br /><br />If I were a European citizen (and I hope to be one soon), would be very proud indeed. Too bad my country&#39;s space agency is going down the gutter (NASA), or is mostly just for the military, which I oppose...<br /><br />I guess I can still be proud as a fellow human, at the very least.",11/13/2014,2:03:22,Top Level
Andrew Swallow (Thor),Awesome video with an accomplishment to match! Bravo. ,11-12-2014,23:36:39,Top Level
Gaze73,I forgot the name of this film so I searched for &quot;rosetta lord baelish&quot; and it was the first result.,11-12-2014,21:12:22,Top Level
Leonw Feng,"Now European try make something(like the point of this movie)to let Alien notice their View of the reality we already hav now , naïve but warm.love it ",11-12-2014,19:50:27,Top Level
MrMieszko24,P<br />O<br />L<br />S<br />K<br />A<br />Bardzo fajny filmik.,11-12-2014,19:32:52,Top Level
luckyea7,?????????,11-12-2014,18:10:53,Top Level
EuropaH2oAlien,<br /><br />Outstanding promotion!! My hope is that the human species will put aside petty differences and reach for the stars. Science rocks!<br />,11-12-2014,16:49:25,Top Level
2003Slade,The misson was a success!,11-12-2014,16:33:42,Top Level
kelley davis,"Let&#39;s go. Time to go. <br /><br />When I was in biology class as a kid, they did that Petri dish thing with the fungus. Then they told us. &quot;This is what will happen to us&quot; and I was like &quot;Bull Shit son. First this ain&#39;t a Petri dish. second we are not a fungus. We will figure it out.&quot; ",11-12-2014,16:31:29,Top Level
Tribalm _,"Fuck you, Baelish. ",11-12-2014,10:54:58,Top Level
Olaf Klischat,"24 hours from now, this movie will seem either stupid and overly ambitious or bold and visionary.",11-12-2014,0:26:23,Top Level
hadhad69,Matthew McConaughey&#39;s makeup is second to none in this...Oscar worthy I think!,11-11-2014,18:51:46,Top Level
Vane Fal,"Yeah, its amazing how convincing he looks as the young girl apprentice!  Great work!",11/18/2014,16:41:29,Reply
Chromatic // Thanks for 9k!!,amazing.,11-11-2014,18:35:26,Top Level
marcianocalvi,"Congratulations to everyone involved in the project. This work is excellent, exciting, sensitive and yet strong. And of course, better than most feature film of the genre.",11-11-2014,18:20:05,Top Level
Egle Alex,<a href=\"http,11-11-2014,3:20:02,Top Level
Konrad Mostert,petyr balish^^,11-10-2014,14:22:51,Top Level
Capt'n Aidy,"Lets hope all goes well, and the landing is a success, 2 days to go, I cannot wait",11-10-2014,13:43:44,Top Level
mariosso2008,Amazing work Tomasz!,11-10-2014,7:41:49,Top Level
Lukasz Ustupski,O Littlefinger,11-10-2014,1:02:42,Top Level
#NAME?,"This talks a lot about water, yet there isn&#39;t any to see. Foreboding?",11-09-2014,16:22:48,Top Level
Alex Lusth,"I litterera just googled  &quot;LITTLE FINGER SPACE MAN&quot; cause I needed to find this clip again, and it worked!",11-07-2014,10:20:50,Top Level
dharmesh bhalala,amazing. no words to describe,11-07-2014,9:32:33,Top Level
Ewa Dziadosz,to juz za piec dni!<br />(12 listopada)  ,11-07-2014,8:56:40,Top Level
Super Duper,wrzuccie wersje 60 fps,11-07-2014,2:49:35,Top Level
Thevenox33,1080p max? zarT?,11-06-2014,18:37:23,Top Level
alf redis,"Brilliant, unbelievable, thanks ",11-06-2014,18:34:22,Top Level
Skastrik,I kinda wish they&#39;ll have the ambition to make this short become a trailer for a feature film. Really nice.,11-06-2014,0:01:15,Top Level
Daniel Danielsson,"Great! This vision could work nicely as a feature. Kickstarter, anyone?",11-04-2014,13:49:00,Top Level
iraqili,how much this film cost?,11-04-2014,6:18:47,Top Level
Dianaranda123,"Phenominally made, hope someday we reach this level of mastery over the elements aswell.",11-03-2014,12:36:30,Top Level
Wizastudios,"This was great, I actually wish this was a full length picture now. ",11-03-2014,10:10:29,Top Level
Mahmoud El Sanadedy,looks great ,11-02-2014,17:05:51,Top Level
Kazio Luzak,"Jak ja bym chcial, aby Baginski wzial sie za ekranizacje ksiazek Lema na przyklad &quot;Niezwyciezony&quot;.",11-02-2014,16:28:54,Top Level
Le Baguette/Vayne La Main,Azubu Ambition!,11-02-2014,12:09:43,Top Level
Béla Gulyás,"&#39;A 7 minute trailer to a 20 year mission&#39;<br /><br />Tomek Baginski’s AMBITION, starring Aidan Gillen (GAME OF THRONES) and Aisling Franciosi (THE FALL), plays a key part in supporting the European Space Agency (ESA)’s Rosetta mission (<a href=\""http",11-02-2014,11:54:03,Top Level
marta staruch,"This is so so good, professional, I&#39;m unbelievably impressed.",11-02-2014,9:34:28,Top Level
Marcin Zebrowski,JAk zawsze Baginski miazdzy!!!,11-02-2014,8:40:08,Top Level
ADAM MONTOYA,"everything is impossible until someone does it, hell, a few thousand years ago, in  a place called Egypt, people thought it was impossible for a pillar to stand without support may we continue to push the impossible and prosper as a species.  &quot; they are of one language and one people and this is only the beginning of what they will do, nothing they propose to do will be impossible for them now&quot;",11-01-2014,10:49:09,Top Level
Walt Kowalski,Good job Tomek and all Crew.,10/31/2014,22:01:08,Top Level
???? ????,????????),10/31/2014,21:00:39,Top Level
8Paul7,That uh...that was great.,10/31/2014,17:52:17,Top Level
yanniclord,"Is it just me that wants this to be a whole movie? I mean the animations were really awesome, and as a whole movie it would make it even more awesome.",10/31/2014,17:52:08,Top Level
Joshua Dworkin,I wish NASA would do films like this.,10/31/2014,9:35:17,Top Level
lovepack54,"They finally figured out how to get the masses interested in their missions. NASA, take note.",10/31/2014,5:24:32,Top Level
Henrik Lundqvist,"Pride goes before destruction, and an haughty spirit before a fall. The pride of your heart has deceived you, you who live in the clefts of the rocks and make your home on the heights, you who say to yourself, &#39;Who can bring me down to the ground?&#39;",10/31/2014,0:30:04,Top Level
asdf30111,But with out pride nothing would get done. No one would try to show of the new fire they &quot;tamed&quot;.... Or how they can kill from far away. Or show of the new space ship that can travel to mars ect. Too much is bad but no pride is also bad.,11-02-2014,14:23:56,Reply
Andrew Montanez,OMG all I can think is I would love to see this as a Full Feature Length Film....hell even a string of films would be AMAZINGGG,10/30/2014,23:33:23,Top Level
Umam K,kerennnnn,10/30/2014,17:59:39,Top Level
Rich Brown,you should see what i can do with my little finger,10/30/2014,17:27:03,Top Level
thirty six nano seconds,"He filed a flight plan with the agency, the European Space Agency",10/30/2014,16:34:47,Top Level
Nomad Saurus,Dukaj!,10/29/2014,22:17:14,Top Level
Alex Lusth,that was seriously awesome! ,10/29/2014,21:14:53,Top Level
Ryan Smith,They need to make this into a tv series or something EPIC!,10/29/2014,20:10:03,Top Level
Walt Kowalski,This is only short,10/31/2014,22:18:49,Reply
Lulu Mae,"Wyczuwam w filmie klimat starych opowiadan sci-fi z &quot;Fantastyki&quot; i nie tylko. Az poczulam zapach starej gazety. Plakaty to juz w ogóle przywoluja mnóstwo wspomnien, Bardzo podoba mi sie muzyka, która u Baginskiego zwykle jest mocnym elementem, wedlug mnie wspaniale wybiera on twórców. Byloby cudownie, gdyby powstaly dluzsze kawalki z tematem &quot;Water&quot;. Co do gry aktorskiej - odpowiada mi, wpasowuje sie w wykreowana rzeczywistosc, nie watpilam w nia ani chwili. Po prostu akceptuje ten film w calosci i przyjmuje go z ogromna wdziecznoscia, bo wszystko swietnie sie zgralo i stworzylo niezwykly swiat. O efektach specjalnych chyba nie musze nic mówic - Platige, i wszystko jasne. Nurtuje mnie uroda aktorki - caly czas mialam wrazenie, ze skads ja kojarze, ale okazalo sie, ze nie widzialam z nia zadnego filmu.<br />Obawy rodzaju wiedzminskiego mnie takze trzymaja, ale wierze, ze skoro Baginski tak dobrze wyczuwa &quot;istote&quot; róznych opowiesci, to nie pozwoli sobie na porazke. Pewnie ma swiadomosc presji, jaka za soba niesie produkcja tego filmu i postara sie jak najlepiej zreallizowac calosc.<br />Zreszta nawet, jesli film bedzie dopracowanym w kazdym calu arcydzielem i tak po premierze znajda sie osoby dosadnie wyrazajace swoje niezadowolenie. To nieuniknione, wiec ekipa &quot;Wiedzmina&quot; po protu powinna dac z siebie wszystko tak, zeby byla usatysfakcjonowana swoja praca.",10/29/2014,19:58:25,Top Level
jo han,"Born from Ais, to Ais ye shall return.....",10/29/2014,19:44:10,Top Level
Shane Simpson,why no vimeo,10/29/2014,17:58:19,Top Level
Lex Starwalker,Awesome! Very well done!,10/29/2014,15:18:34,Top Level
tata socjopata,this is ambitious,10/29/2014,7:54:33,Top Level
Jiufu Cai,westeros is screwed if littlefinger can earth bend ,10/29/2014,5:51:38,Top Level
Pablo Tato,espectacular,10/29/2014,3:57:55,Top Level
Robert Sharp,amazing,10/29/2014,2:39:05,Top Level
Movie knights,"Absolutely mind blowing, this seriously need a full sci - fi film like this.",10/29/2014,1:20:12,Top Level
AdrikPL8,Littlefinger!,10/29/2014,0:07:50,Top Level
Welt Rogg,"Useless, empy. Nothing new. Bad acting, no meaning and logic chain.<br />Polish is worst country for films director and actors. This the most boring thing ever seen by me for my 30 years.<br />I know some films from this country, this is suicidal vomit.",10/28/2014,20:10:13,Top Level
zaczes999,"Yeah, I guess that Kieslowski, early Wajda, Polanski, etc. are just terrible, atrocious directors with no talent whatsoever. Go eat a dick.",10/30/2014,8:53:25,Reply
ZD “zebtmoney” AAT,Did you use google translate?,10/28/2014,23:04:07,Reply
Dav3,You could put that music to any video and instantly make it interesting.,10/28/2014,20:09:30,Top Level
Krzysztof Kaczmarek,Good Job ,10/28/2014,19:37:18,Top Level
Gaston D'antos,Beautiful,10/28/2014,18:18:25,Top Level
nifas31,Great!) ,10/28/2014,17:42:29,Top Level
SonMarek,Kto robil te efekty specjalne i gdzie sie ich nauczyl?,10/28/2014,17:17:44,Top Level
Mariano Tello Nocetti,This is so bad ass!!!,10/28/2014,15:54:28,Top Level
slickysan,What kind of cretin down-votes this?,10/28/2014,14:41:40,Top Level
Barbara Korcyl,"Tomek Baginski, wspaniala praca, zycze wielu sukcesow ...",10/28/2014,14:01:56,Top Level
Tifanny Ramdayal,"Promptly rewrote half my plot after watching this. Oh yes, ambition.",10/28/2014,13:05:45,Top Level
DJ BitMaster V2,Chcecie dobrej muzyki zapraszam do mnie na kanal. Znajdziecie yu wszystkie gatunki muzyczne <br />Zapraszam do sluchania,10/28/2014,12:10:43,Top Level
regnar toja,Sansa Stark and Petyr Baelish ???,10/28/2014,8:31:39,Top Level
Kuba Nazarewicz,God i love Platige Image!,10/28/2014,1:36:51,Top Level
Alex Denby,I found this on r/Numenera; is there any relation to the roleplaying game?,10/28/2014,1:14:17,Top Level
Darek Lenovo,"Baginski, Polska Mysl Techniczna, obraz sie idioto ? maly umysl mala odpowiedz na miare KOPERNIKA <br />Odsuniecie PO SLD PSL CPUNA od wladzy jest mozliwe",10/27/2014,23:59:01,Top Level
Keddiels,uwot,10/27/2014,23:19:01,Top Level
leazxcv,nice!,10/27/2014,23:05:29,Top Level
Nick Wade,Brilliant.  I would pay well to see a movie with these two as nanomancers.,10/27/2014,22:35:24,Top Level
Young Wolf,Knowledge is Power,10/27/2014,22:26:56,Top Level
Dziki z lasu,"Spokojnie Baginski z ESA moga sie brac za stworzenie w tej koncepcji filmu pelnometrazowego, ten mix Sci-fi z dokumentem jest wrecz niesamowity. Przy okazji zarobili by pewnie na kolejna ambitna misje",10/27/2014,21:37:04,Top Level
Robert Giver,Dziwi mnie tak mala ilosc glosów na nie czy to tez manipulacja ?,10/27/2014,21:32:47,Top Level
Francis Acupan,Atanas Valkov&#39;s music playlist seems to be missing.  Help!,10/27/2014,21:31:03,Top Level
Mango Mango.,A ja nadal czekam na pelnometrazowy  film ;),10/27/2014,21:22:51,Top Level
Aleksdraven,"5 minut czystego s-f, niezlej muzyki i do tego swietna reklama misji rosetta.",10/27/2014,20:36:56,Top Level
Tomasz Pest,Jestem z Was dumny Panowie. Swietna rzecz. Wbija w fotel,10/27/2014,20:36:41,Top Level
Lechupacabra,"Do Twórców. Jestem z was dumy. Piekny pomysl, pieknie zrealizowany. ",10/27/2014,19:49:31,Top Level
Sándor Kovács,"Oh, it&#39;s the Sneaky Guy",10/27/2014,19:36:44,Top Level
Paul Hansford,Better than most movies I&#39;ve seen,10/27/2014,18:20:07,Top Level
Logical Tantrums,"This is absolutely amazing. This generation will have feelings about the Rosetta mission, similar to the feelings previous generations had about landing on the Moon. &quot;We fall and we pick ourselves back up.&quot;",10/27/2014,18:07:25,Top Level
Krono Mikon,our evolution is too slow.<br />Time for a very big breakthrough,10/27/2014,18:02:59,Top Level
Marcin Obuchowski (Czeladnik),Avatar!,10/27/2014,17:44:51,Top Level
butteredtoast22,Littlefinger sure does like them young.,10/27/2014,17:36:51,Top Level
Price_PL,Cast,10/27/2014,17:33:58,Top Level
selektorat,"The movie depicts one European Space Agency professor&#39;s ambition to be a movie producer, at taxpayers&#39; expense.<br />Well done, probably the prettiest piece of propaganda since Leni Riefenstahl. ",10/27/2014,17:02:52,Top Level
DestinFighterz,BAGINSKI KRÓL DZIEKUJE DOBRANOC,10/27/2014,16:32:59,Top Level
eustachy999,Little Finger,10/27/2014,16:27:09,Top Level
Roman Abramyan,"Great! Please, add russian sub.",10/27/2014,15:29:50,Top Level
Esteban Flores,Films like this are exactly what we need to enchant humanity!!!!!,10/27/2014,15:09:58,Top Level
lanceortega1,Ma gosc talent!,10/27/2014,14:29:40,Top Level
Maciek “Nervi” Nervooz,"Patrzac na ten film sadze ze produkcja gier i filmów to tylko dwie rzeczy sposród wielu, dzieki którym o Polsce bedzie przez najblizszych kilka lat bardzo glosno...",10/27/2014,13:57:51,Top Level
????? ????????,"Can someone, please, post some links of other projects of the same director and team members ? Thank you in advance guys.<br /><br />P.S. From my point of view",10/27/2014,13:57:37,Top Level
Adam Surowiec,"There is <b>some possibility</b> that he will be directing new The Witcher movie. No dont watch the old one (called also Hexer). It was not his work, and it was total disaster. Nobody wants to remember it.",11-09-2014,18:30:13,Reply
tricecold,"its all in the credits man, including me",11-08-2014,15:17:20,Reply
Adam Surowiec,<a href=\"https,10/28/2014,11:35:27,Reply
Plastek5591,"no musze powiedziec ze zrobilo to na mnie nie male wrazenie, lecz jesli Pan Baginski chce by film Wiedzmin byl wysokiej klasy AAA filmem to musi sie duzo bardziej postarac. Kazdy blad bedzie mu wytykany na kazdym kroku.",10/27/2014,13:54:02,Top Level
Simon Cornelius P Umacob,Petyr Baelish will always be a creepy child molester... Hahaha...,10/27/2014,13:34:39,Top Level
Roman Mandziejewicz (SQUADACK),Prawie jak Natalie Portman ;),10/27/2014,11:16:24,Top Level
MsLiljanka,"O, mamy 47 roninów ;)<br /><br />Za tydzien bedzie 101 dalmatynczyków ;)",10/27/2014,10:36:21,Top Level
Miro Z Lasa (Nakyy93),Polak potrafi,10/27/2014,10:20:09,Top Level
E N,kick starter this short film and make a full movie out of this! holy crap!,10/27/2014,9:15:13,Top Level
Vladhin,"Muzyka &lt;3 Dobrze wiedziec, ze Pan Tomasz nie próznuje i siega coraz wyzej.",10/27/2014,8:17:58,Top Level
shonenpropro,Czy Maciej Sieradzky dziergal szaliczek?,10/27/2014,7:39:39,Top Level
JHHBeck,"If this were a show, I&#39;d watch the shit out of it.",10/27/2014,6:30:49,Top Level
Weasel Level Design,<a href=\"http,10/27/2014,6:27:02,Top Level
starmedic,bitchin.  all i gotta say.,10/27/2014,5:40:56,Top Level
YMBatal,Love it.,10/27/2014,5:23:56,Top Level
Jonathan Castillo,So gorgeous and inspiring!  ,10/27/2014,5:19:04,Top Level
Stephen N,This is awesome! ,10/27/2014,5:05:22,Top Level
Szach Szach,10-Jul,10/27/2014,4:51:31,Top Level
mcrazza,Needs more Vimeo.,10/27/2014,4:48:55,Top Level
Endyo,"Great work, I love education in entertainment so good you can&#39;t tell.  I also like that credits song, anyone know what it is?",10/27/2014,4:45:27,Top Level
Tari Akpodiete,might be interesting as a feature. could this be the prelude to such?,10/27/2014,2:34:30,Top Level
o0thx11380o,"After you watch this and are inspired about the future and the amazing things humanity could achieve... Think about the tea party, and weep.",10/27/2014,2:17:35,Top Level
Artur Rybak,Littlefinger!,10/27/2014,0:26:06,Top Level
Adamov Bagdanov,slabi aktorzy i rezyseri brak,10/27/2014,0:19:35,Top Level
Bronimir,Swietne!,10/27/2014,0:17:17,Top Level
Bartek Koziol,"Kogo widzicie w roli Geralta? Jakos nie moge sobie wyobrazic znanych i cenionych aktorów grajacych polskiego Wiedzmina i mysle, ze ponowne obsadzenie Zebrowskiego nie byloby wcale glupim pomyslem.",10/26/2014,22:51:17,Top Level
P42,"Niesamowite efekty, ale jak dla mnie za krótkie... Oczekiwalem czegos zaskakujacego na koniec jak w Katedrze... Zabraklo mi tez scen z trailera np. podzialu komórki...<br />Ale mimo to, wspaniala produkcja! ^_^",10/26/2014,21:25:03,Top Level
Timi Tim,wooooow chcial bym zobaczyc pelny film ;&gt;,10/26/2014,21:23:30,Top Level
Madeline M,"Haaaa! I takie rzeczy sprawiaja, ze nadal wierze w Polaków ;p ",10/26/2014,21:10:48,Top Level
Kamiloso,The song at the star of the end credits is very similar to Mass Effect,10/26/2014,20:50:30,Top Level
mountainduwe,What is it with Littlefinger keeping the company of teenage girls? C&#39;mon son,10/26/2014,20:39:04,Top Level
majster893,Albo mi sie wydaje albo w <a href=\"http,10/26/2014,20:34:39,Top Level
lgtco99,"Doskonale wykonany film promujacy tak wazna misje, a wy tyko pierdolicie o Wiedzminie",10/26/2014,19:51:24,Top Level
Lemmy Kilmister,Tyle sie zmienilo od Katedry... Oby Wiedzmin byl równie dobrze zrobiony.,10/26/2014,19:27:37,Top Level
Jonathan Thomas,where  can i listen to the sound track?,10/26/2014,18:47:18,Top Level
Monika Matyga,<a href=\"https,10/26/2014,20:57:43,Reply
Szczypiorenki,kijowe dialogi,10/26/2014,18:18:40,Top Level
quap,"Tutaj najwazniejsze sa efekty specjalne. W Wiedzminie najwazniejsi sa aktorzy. Skoro nie bedzie on animacja, to ciekaw jestem kto wcieli sie w glównych bohaterów, bo z polskich aktorów ciezko bedzie znalezc kogos dobrego...",10/26/2014,18:12:58,Top Level
boreks200s,"Michal Zebrowski w roli Geralta byl mozna smialo powiedziec dobry jako jedyny z tych aktorów tak naprawde co nie zmienia faktu ze w nowej produkcji tego filmu moze okazac sie zbyt slaby.Znam bardzo dokladnie postac Geralta jak i samego wiedzmina dlatego wiem co mówie.W nowym wiedzminie bedzie naprawde trudno dobrac odpowiedniego aktora który wcieli sie w Geralta poniewaz zaden z polskich aktorów nie jest doswiadczony w filmach science fiction a zapewne bedzie film tego typu.Mozna tu tylko gdybac jak na razie i czekac na jakies nowe wiesci na temat tego filmu,jezeli on w ogóle powstanie.",10/26/2014,19:08:28,Reply
Mordixx,better then micheal bay xD,10/26/2014,16:40:46,Top Level
Sven Malefist,"Fajnie, tylko ze scenariusz z dupy. Ale ladne obrazki na prawde chcialoby sie zeby w Polsce ktos mial budzet na produkcje naszych rodzimych autorow jak Lem, np. Niezwyciezony albo Fiasko. Wiedzmin, nie prosze nie, to jak odcinanie kuponow z LOTR i Harrego Pottera, kto chce jeszcze raz ogladac smoki....",10/26/2014,15:23:34,Top Level
Sven Malefist,<span class=\"proflinkWrapper\"><span class=\"proflinkPrefix\">+</span><a class=\"proflink\" href=\"https,10/27/2014,16:13:51,Reply
CoffeeCupGaming,<span class=\"proflinkWrapper\"><span class=\"proflinkPrefix\">+</span><a class=\"proflink\" href=\"https,10/27/2014,16:03:04,Reply
Sven Malefist,<span class=\"proflinkWrapper\"><span class=\"proflinkPrefix\">+</span><a class=\"proflink\" href=\"https,10/27/2014,13:41:59,Reply
CoffeeCupGaming,<span class=\"proflinkWrapper\"><span class=\"proflinkPrefix\">+</span><a class=\"proflink\" href=\"https,10/27/2014,12:24:30,Reply
Sven Malefist,"To nie jest topic o mnie ale o tym, ze fajnie by bylo jakby sie zabrano za bardziej kultowe dziela polskich pisarzy niz Wiedzmina, ktory relatywnie jest tak dobry jak Double Whopper przy rasowym kotlecie schabowym. Jak sie nikt za to nie wezmie w pore to juz tylko pozostana jacys amerykanscy scenarzysci ktorzy przerobia fajna ksiazke na alternatywna ksiazke z alternatywnym zakonczeniem tak jak to zrobiono w Solaris. Jak sie teraz przygladam AMBITION to jest cos w tym totalnie bzdurnego tak jak cale fantasy jest bajka jak to sie ma do prawdziwej misji kosmicznej... pewno wiedza to tylko fani Sapkowskiego.",10/27/2014,9:24:50,Reply
Jakub Wrona,I know this guy. He played in &quot;The Wire&quot; - tv series. He was great there.,10/26/2014,15:17:35,Top Level
Katarzyna Kowalska,<span class=\"proflinkWrapper\"><span class=\"proflinkPrefix\">+</span><a class=\"proflink\" href=\"https,11/29/2014,23:32:26,Reply
Ptaku93,<span class=\"proflinkWrapper\"><span class=\"proflinkPrefix\">+</span><a class=\"proflink\" href=\"https,10/28/2014,12:53:16,Reply
Souperfro,Or Game of Thrones,10/26/2014,22:51:16,Reply
Azoruk,Destroying the rock? Was this part of your plan too?,10/26/2014,14:41:34,Top Level
Nivellen89,Sa jakies szanse na pliki mp3 ze sciezka dzwiekowa?,10/26/2014,14:22:26,Top Level
winda tekili,zgraj sobie sam,10/26/2014,15:04:20,Reply
Exfederale,"Film swietny. Piekne zdjecia i extra muzyka. Ale oczywiscie znalazlo sie 25 mongolów, którym sie nie podoba. Czyzby niezgodne z Prawdami w Swietych Ksiegach?",10/26/2014,13:43:34,Top Level
winda tekili,gdzie jest mowa o 67P/Czuriumow-Gierasimienko w swietych ksiegach ?,10/26/2014,15:01:58,Reply
Bren Jordan,Holy flip! Stunning work!!,10/26/2014,13:25:33,Top Level
Paula K,can you tell me what melody/song/etc. starts in <a href=\"http,10/26/2014,13:04:53,Top Level
Veselin Filev,The music is written by Atanas Valkov,10/26/2014,13:34:10,Reply
MICHAL BROLL,Nic tylko trzeba byc dumnyn z faktu ze jest ktos taki z takimi umiejetnosciami w Polsce,10/26/2014,12:57:01,Top Level
Techy630,mam podobnie jak mam kaca wtedy sprawdzam czy jest magiczna water ;]]],10/26/2014,12:49:29,Top Level
winda tekili,/watch?v=z3LRjFj452E nie wody tylko piwa na kaca,10/26/2014,15:03:24,Reply
hyylo,in ELON MUSK we trust ,10/26/2014,12:40:26,Top Level
Mike Litoris,This could be the end of GoT with Baelsh being the last survivor,10/26/2014,12:30:28,Top Level
MrErdece,Panie Baginski - do &quot;Wiedzmina&quot; przystap!,10/26/2014,12:28:07,Top Level
bansheewoj,Pieknie zrobione. Panie Tomaszu. Wyrazy uznania!,10/26/2014,12:26:09,Top Level
SuperNovaPL,"Cant wait to see Witcher the movie, after what I saw here ",10/26/2014,12:22:54,Top Level
MrJynkypt,So good...,10/26/2014,11:40:01,Top Level
Panna Marzanna,23 people have NO AMBITION!,10/26/2014,11:17:56,Top Level
Anna Podsiadlo,czekam na &quot;Wiedzmina&quot; - bardzo.,10/26/2014,11:00:39,Top Level
Erick Pombo,amazing!,10/26/2014,10:35:24,Top Level
